{"$schema":"https://json-schema.org/draft/2020-12/schema","additionalProperties":false,"description":"Human-attested review decision bound to one exact durable candidate generation; semantic validation is enforced by dpslab.candidate_knowledge_review.","properties":{"assessment":{"type":"object"},"binding":{"type":"object"},"decision":{"type":"object"},"identity":{"type":"object"},"integrity":{"type":"object"},"schema_version":{"const":"0.1"}},"required":["schema_version","identity","binding","assessment","decision","integrity"],"title":"DpsLab candidate knowledge-set review decision 0.1","type":"object"}
