{"assessment":{"applicability":"applicable","freshness":"current","interface":120500,"no_automation_confirmed":true,"role":"damage","role_safety":"satisfied","source_coverage":"complete","wow_build":120500},"binding":{"candidate_catalog_sha256":"633e53a1ffc4522df0e0204d0bc5ec2c166b9d8452919e4d74dbf6141dd4c954","candidate_envelope_sha256":"2693fa536a68c725cf4d12a800fe6e192c834ba89c6672f9b8e93b1852c32861","commit_sha256":"219527aae18d99c6076902185acae14d3d57dee24d8cf5bf98f98961c39d2ae2","generation_id":"candidate.synthetic.001","marker_sha256":"ecca344fb0ecf327ff37224fbdd0f1daa03caff3ead6d8ce0635a755624301b8","proposal_decision_sha256":"76a6fa2410389e46b4410469a16b9bc8078e5d92a7db01fc913ba6a5021c2583","proposal_sha256":"9b0256a5f40445c8448e66713d7774067b887ce627d4b44e0b4b95c0648fd866","receipt_sha256":"20c882fb82f3c0bbb82c61e9696a75f446ac86931e7b64ccb00025ce1af08990","source_catalog_sha256":"decef73f2d25d82a174e27c50d9584be3f11037328ab660a6fe6f04e189d70e9","source_envelope_sha256":"0aa67412ee12876998a9ae2bb49c5698463aaac332a2c17ce6169dcf9125d8aa"},"decision":{"authority_reference":"n0.gov.synthetic","decided_at":"2026-08-01T06:30:00Z","human_attestation_id":"human.attestation.synthetic.001","limitations_acknowledged":["candidate_pending_review","not_live_balance_guidance","synthetic_fixture_only"],"outcome":"approved","reason_codes":["candidate.review.human_approved","damage.contextual_dps"],"reviewer_id":"daniel"},"identity":{"created_at":"2026-08-01T06:30:00Z","decision_id":"candidate.review.synthetic.001"},"integrity":{"decision_sha256":"7466258e0028fe702c8dbc6b89ef401a8a80c9b6add191d7981f3315046471c4","hash_algorithm":"sha256"},"schema_version":"0.1"}
